{
  "$schema": "../../schema/feat.schema.json",
  "id": "boon-of-irresistible-offense",
  "name": "Dádiva do Ataque Irresistível",
  "category": "epic-boon",
  "categoryLabel": "Dádiva Épica",
  "typeLabel": "Talento de Dádiva Épica",
  "repeatable": false,
  "prerequisite": "Nível 19 ou superior",
  "source": {
    "book": "Livro do Jogador 2024",
    "language": "pt-BR",
    "chapter": 5,
    "chapterTitle": "Talentos",
    "pdfPath": "doc/livro-jogador.pdf",
    "pdfPages": [
      205,
      217
    ],
    "extractedAt": "2026-06-25T01:46:09.823Z"
  },
  "benefits": [
    {
      "name": "Aumento no Valor de Atributo",
      "description": "Aumente seu valor de Força ou Destreza em 1, até no máximo 30."
    },
    {
      "name": "Superar Defesas",
      "description": "O dano Contundente, Cortante e Perfurante que você causa sempre ignora Resistência."
    },
    {
      "name": "Golpe Devastador",
      "description": "Quando você tira 20 no d20 para uma jogada de ataque, pode causar dano adicional ao alvo igual ao valor do atributo aumentado por este talento. O tipo de dano adicional é o mesmo do ataque."
    }
  ]
}
