{
  "$schema": "../../schema/feat.schema.json",
  "id": "martial-weapon-training",
  "name": "Treinamento com Armas Marciais",
  "category": "general",
  "categoryLabel": "Geral",
  "typeLabel": "Talento Geral",
  "repeatable": false,
  "prerequisite": "Nível 4 ou superior",
  "source": {
    "book": "Livro do Jogador 2024",
    "language": "pt-BR",
    "chapter": 5,
    "chapterTitle": "Talentos",
    "pdfPath": "doc/livro-jogador.pdf",
    "pdfPages": [
      205,
      217
    ],
    "extractedAt": "2026-06-25T01:46:09.815Z"
  },
  "benefits": [
    {
      "name": "Aumento no Valor de Atributo",
      "description": "Aumente seu valor de Força ou Destreza em 1, até no máximo 20."
    },
    {
      "name": "Proficiência com Armas",
      "description": "Você adquire proficiência com armas Marciais."
    }
  ]
}
