{
  "$schema": "../../schema/feat.schema.json",
  "id": "great-weapon-master",
  "name": "Mestre em Armas Grandes",
  "category": "general",
  "categoryLabel": "Geral",
  "typeLabel": "Talento Geral",
  "repeatable": false,
  "prerequisite": "Nível 4 ou superior, Força 13 ou superior",
  "source": {
    "book": "Livro do Jogador 2024",
    "language": "pt-BR",
    "chapter": 5,
    "chapterTitle": "Talentos",
    "pdfPath": "doc/livro-jogador.pdf",
    "pdfPages": [
      205,
      217
    ],
    "extractedAt": "2026-06-25T01:46:09.809Z"
  },
  "benefits": [
    {
      "name": "Aumento no Valor de Atributo",
      "description": "Aumente seu valor de Força em 1, até no máximo 20."
    },
    {
      "name": "Maestria em Armas Pesadas",
      "description": "Quando você atinge uma criatura com uma arma que tem a propriedade Pesada como parte da ação Atacar no seu turno, você pode causar dano adicional ao alvo com a arma. O dano adicional é igual ao seu Bônus de Proficiência."
    },
    {
      "name": "Cortar",
      "description": "Imediatamente após obter um Acerto Crítico ou reduzir uma criatura a 0 Pontos de Vida com uma arma Corpo a Corpo, você pode realizar um ataque com a mesma arma como uma Ação Bônus."
    }
  ]
}
