{
  "$schema": "../../schema/feat.schema.json",
  "id": "boon-of-energy-resistance",
  "name": "Dádiva da Resistência à Energia",
  "category": "epic-boon",
  "categoryLabel": "Dádiva Épica",
  "typeLabel": "Talento de Dádiva Épica",
  "repeatable": false,
  "prerequisite": "Nível 19 ou superior",
  "source": {
    "book": "Livro do Jogador 2024",
    "language": "pt-BR",
    "chapter": 5,
    "chapterTitle": "Talentos",
    "pdfPath": "doc/livro-jogador.pdf",
    "pdfPages": [
      205,
      217
    ],
    "extractedAt": "2026-06-25T01:46:09.821Z"
  },
  "benefits": [
    {
      "name": "Aumento no Valor de Atributo",
      "description": "Aumente um valor de atributo à sua escolha em 1, até no máximo 30."
    },
    {
      "name": "Resistências à Energia",
      "description": "Você obtém Resistência a dois dos seguintes tipos de dano à sua escolha: Ácido, Elétrico, Gélido, Ígneo, Necrótico, Psíquico, Radiante, Trovejante ou Venenoso. Sempre que completar um Descanso Longo, você pode mudar suas escolhas."
    },
    {
      "name": "Redirecionamento de Energia",
      "description": "Ao sofrer dano de um dos tipos escolhidos para o benefício Resistências à Energia, você pode executar uma Reação para direcionar o dano do mesmo tipo para outra criatura à sua vista a até 18 metros de você que não esteja sob Cobertura Total. Se você fizer isso, essa criatura deve ser bem-sucedida em uma salvaguarda de Destreza (CD 8 mais seu modificador de Constituição e seu Bônus de Proficiência) ou sofre dano igual a 2d12 mais seu modificador de Constituição."
    }
  ]
}
