{
  "$schema": "../../schema/feat.schema.json",
  "id": "dual-wielder",
  "name": "Especialista Ambidestro",
  "category": "general",
  "categoryLabel": "Geral",
  "typeLabel": "Talento Geral",
  "repeatable": false,
  "prerequisite": "Nível 4 ou superior, Força ou Destreza 13 ou superior",
  "source": {
    "book": "Livro do Jogador 2024",
    "language": "pt-BR",
    "chapter": 5,
    "chapterTitle": "Talentos",
    "pdfPath": "doc/livro-jogador.pdf",
    "pdfPages": [
      205,
      217
    ],
    "extractedAt": "2026-06-25T01:46:09.803Z"
  },
  "benefits": [
    {
      "name": "Aumento no Valor de Atributo",
      "description": "Aumente seu valor de Força ou Destreza em 1, até no máximo 20."
    },
    {
      "name": "Combate com Duas Armas Aprimorado",
      "description": "Quando você executa a ação Atacar no seu turno com uma arma que tenha a propriedade Leve, pode realizar um ataque adicional como uma Ação Bônus no mesmo turno com uma arma diferente, que deve ser uma arma Corpo a Corpo que não possua a propriedade Duas Mãos. Você não pode adicionar o seu modificador de atributo ao dano do ataque adicional, a menos que o modificador seja negativo."
    },
    {
      "name": "Saque Rápido",
      "description": "Você pode desembainhar ou embainhar duas armas que não possuam a propriedade Duas Mãos quando normalmente poderia desembainhar ou embainhar apenas uma."
    }
  ]
}
