{
  "$schema": "../../schema/feat.schema.json",
  "id": "boon-of-fortitude",
  "name": "Dádiva da Fortitude",
  "category": "epic-boon",
  "categoryLabel": "Dádiva Épica",
  "typeLabel": "Talento de Dádiva Épica",
  "repeatable": false,
  "prerequisite": "Nível 19 ou superior",
  "source": {
    "book": "Livro do Jogador 2024",
    "language": "pt-BR",
    "chapter": 5,
    "chapterTitle": "Talentos",
    "pdfPath": "doc/livro-jogador.pdf",
    "pdfPages": [
      205,
      217
    ],
    "extractedAt": "2026-06-25T01:46:09.820Z"
  },
  "benefits": [
    {
      "name": "Aumento no Valor de Atributo",
      "description": "Aumente um valor de atributo à sua escolha em 1, até no máximo 30."
    },
    {
      "name": "Saúde Fortalecida",
      "description": "Seus Pontos de Vida máximos aumentam em 40. Além disso, sempre que você recuperar Pontos de Vida, pode recuperar Pontos de Vida adicionais iguais ao seu modificador de Constituição. Após recuperar esses Pontos de Vida adicionais, você não pode fazer isso novamente até o início do seu próximo turno."
    }
  ]
}
