{
  "$schema": "../../schema/feat.schema.json",
  "id": "healer",
  "name": "Curandeiro",
  "category": "origin",
  "categoryLabel": "Origem",
  "typeLabel": "Talento de Origem",
  "repeatable": false,
  "prerequisite": null,
  "source": {
    "book": "Livro do Jogador 2024",
    "language": "pt-BR",
    "chapter": 5,
    "chapterTitle": "Talentos",
    "pdfPath": "doc/livro-jogador.pdf",
    "pdfPages": [
      205,
      217
    ],
    "extractedAt": "2026-06-25T01:46:09.790Z"
  },
  "benefits": [
    {
      "name": "Médico de Combate",
      "description": "Caso tenha um Kit de Curandeiro, você pode gastar um uso e cuidar de uma criatura a até 1,5 metro de você como uma ação Usar Objeto. Essa criatura pode gastar um dos Dados de Pontos de Vida dela e você joga esse dado. A criatura recupera um número de Pontos de Vida igual à jogada mais o seu Bônus de Proficiência."
    },
    {
      "name": "Cura Garantida",
      "description": "Sempre que jogar um dado para determinar o número de Pontos de Vida que você recupera com uma magia ou com o benefício do talento Médico de Combate, você pode jogar novamente o dado se o resultado for 1, e você deve usar a nova jogada."
    }
  ]
}
