{
  "$schema": "../../schema/feat.schema.json",
  "id": "lightly-armored",
  "name": "Especialista em Armaduras Leves",
  "category": "general",
  "categoryLabel": "Geral",
  "typeLabel": "Talento Geral",
  "repeatable": false,
  "prerequisite": "Nível 4 ou superior",
  "source": {
    "book": "Livro do Jogador 2024",
    "language": "pt-BR",
    "chapter": 5,
    "chapterTitle": "Talentos",
    "pdfPath": "doc/livro-jogador.pdf",
    "pdfPages": [
      205,
      217
    ],
    "extractedAt": "2026-06-25T01:46:09.803Z"
  },
  "benefits": [
    {
      "name": "Aumento no Valor de Atributo",
      "description": "Aumente seu valor de Força ou Destreza em 1, até no máximo 20."
    },
    {
      "name": "Treinamento com Armadura",
      "description": "Você obtém treinamento com Armadura Leve e Escudos."
    }
  ]
}
