{
  "$schema": "../../schema/feat.schema.json",
  "id": "skill-expert",
  "name": "Especialista em Perícia",
  "category": "general",
  "categoryLabel": "Geral",
  "typeLabel": "Talento Geral",
  "repeatable": false,
  "prerequisite": "Nível 4 ou superior",
  "source": {
    "book": "Livro do Jogador 2024",
    "language": "pt-BR",
    "chapter": 5,
    "chapterTitle": "Talentos",
    "pdfPath": "doc/livro-jogador.pdf",
    "pdfPages": [
      205,
      217
    ],
    "extractedAt": "2026-06-25T01:46:09.805Z"
  },
  "benefits": [
    {
      "name": "Aumento no Valor de Atributo",
      "description": "Aumente um valor de atributo à sua escolha em 1, até no máximo 20."
    },
    {
      "name": "Proficiência em Perícia",
      "description": "Você adquire proficiência em uma perícia à sua escolha."
    },
    {
      "name": "Especialização",
      "description": "Escolha uma perícia na qual você tenha proficiência, mas não seja Especialização. Você obtém Especialização nessa perícia."
    }
  ]
}
