{
  "$schema": "../../schema/feat.schema.json",
  "id": "slasher",
  "name": "Talhador",
  "category": "general",
  "categoryLabel": "Geral",
  "typeLabel": "Talento Geral",
  "repeatable": false,
  "prerequisite": "Nível 4 ou superior",
  "source": {
    "book": "Livro do Jogador 2024",
    "language": "pt-BR",
    "chapter": 5,
    "chapterTitle": "Talentos",
    "pdfPath": "doc/livro-jogador.pdf",
    "pdfPages": [
      205,
      217
    ],
    "extractedAt": "2026-06-25T01:46:09.813Z"
  },
  "benefits": [
    {
      "name": "Aumento no Valor de Atributo",
      "description": "Aumente seu valor de Força ou Destreza em 1, até no máximo 20."
    },
    {
      "name": "Debilitar",
      "description": "Uma vez por turno, quando você atinge uma criatura com um ataque que causa dano Cortante, você pode reduzir o Deslocamento dessa criatura em 3 metros até o início do seu próximo turno."
    },
    {
      "name": "Crítico Melhorado",
      "description": "Ao obter um Acerto Crítico que causa dano Cortante a uma criatura, ela tem Desvantagem nas jogadas de ataque até o início do seu próximo turno."
    }
  ]
}
