{
  "$schema": "../../schema/feat.schema.json",
  "id": "medium-armor-master",
  "name": "Mestre em Armaduras Médias",
  "category": "general",
  "categoryLabel": "Geral",
  "typeLabel": "Talento Geral",
  "repeatable": false,
  "prerequisite": "Nível 4 ou superior, Treinamento com Armadura Média",
  "source": {
    "book": "Livro do Jogador 2024",
    "language": "pt-BR",
    "chapter": 5,
    "chapterTitle": "Talentos",
    "pdfPath": "doc/livro-jogador.pdf",
    "pdfPages": [
      205,
      217
    ],
    "extractedAt": "2026-06-25T01:46:09.807Z"
  },
  "benefits": [
    {
      "name": "Aumento no Valor de Atributo",
      "description": "Aumente seu valor de Força ou Destreza em 1, até no máximo 20."
    },
    {
      "name": "Portador Ágil",
      "description": "Enquanto estiver usando armadura Média, você pode adicionar 3, em vez de 2, à sua CA se tiver um valor de Destreza 16 ou superior."
    }
  ]
}
