{
  "$schema": "../../schema/feat.schema.json",
  "id": "poisoner",
  "name": "Envenenador",
  "category": "general",
  "categoryLabel": "Geral",
  "typeLabel": "Talento Geral",
  "repeatable": false,
  "prerequisite": "Nível 4 ou superior",
  "source": {
    "book": "Livro do Jogador 2024",
    "language": "pt-BR",
    "chapter": 5,
    "chapterTitle": "Talentos",
    "pdfPath": "doc/livro-jogador.pdf",
    "pdfPages": [
      205,
      217
    ],
    "extractedAt": "2026-06-25T01:46:09.802Z"
  },
  "benefits": [
    {
      "name": "Aumento no Valor de Atributo",
      "description": "Aumente seu valor de Destreza ou Inteligência em 1, até no máximo 20."
    },
    {
      "name": "Veneno Potente",
      "description": "Ao realizar uma jogada de dano que causa dano Venenoso, você ignora Resistência a dano Venenoso."
    },
    {
      "name": "Preparar Veneno",
      "description": "Você adquire proficiência com o Kit de Veneno. Com 1 hora de trabalho usando esse kit e gastando 50 PO em materiais, você pode fabricar um número de doses de veneno igual ao seu Bônus de Proficiência. Como uma Ação Bônus, você pode aplicar uma dose de veneno a uma arma ou peça de munição. Uma vez aplicado, o veneno retém sua potência por 1 minuto ou até você causar dano com o item envenenado, o que for mais curto. Ao sofrer dano do item envenenado, uma criatura deve ser bem-sucedida em uma salvaguarda de Constituição (CD 8 mais o modificador do atributo aumentado por este talento e seu Bônus de Proficiência) ou sofre 2d8 pontos de dano Venenoso e está com a condição Envenenado até o final do seu próximo turno."
    }
  ]
}
