{
  "$schema": "../../schema/feat.schema.json",
  "id": "archery",
  "name": "Arquearia",
  "category": "fighting-style",
  "categoryLabel": "Estilo de Luta",
  "typeLabel": "Talento de Estilo de Luta",
  "repeatable": false,
  "prerequisite": "Característica de Estilo de Luta",
  "source": {
    "book": "Livro do Jogador 2024",
    "language": "pt-BR",
    "chapter": 5,
    "chapterTitle": "Talentos",
    "pdfPath": "doc/livro-jogador.pdf",
    "pdfPages": [
      205,
      217
    ],
    "extractedAt": "2026-06-25T01:46:09.816Z"
  },
  "benefits": [
    {
      "description": "Você recebe um bônus de +2 nas jogadas de ataque com armas à Distância."
    }
  ]
}
