{
  "$schema": "../../schema/feat.schema.json",
  "id": "boon-of-combat-prowess",
  "name": "Dádiva da Proeza em Combate",
  "category": "epic-boon",
  "categoryLabel": "Dádiva Épica",
  "typeLabel": "Talento de Dádiva Épica",
  "repeatable": false,
  "prerequisite": "Nível 19 ou superior",
  "source": {
    "book": "Livro do Jogador 2024",
    "language": "pt-BR",
    "chapter": 5,
    "chapterTitle": "Talentos",
    "pdfPath": "doc/livro-jogador.pdf",
    "pdfPages": [
      205,
      217
    ],
    "extractedAt": "2026-06-25T01:46:09.820Z"
  },
  "benefits": [
    {
      "name": "Aumento no Valor de Atributo",
      "description": "Aumente um valor de atributo à sua escolha em 1, até no máximo 30."
    },
    {
      "name": "Pontaria Inigualável",
      "description": "Quando você erra uma jogada de ataque, em vez disso você acerta. Após usar este benefício, você não pode utilizá-lo novamente até o início do seu próximo turno."
    }
  ]
}
