{
  "$schema": "../../schema/feat.schema.json",
  "id": "stealthy",
  "name": "Sorrateiro",
  "category": "general",
  "categoryLabel": "Geral",
  "typeLabel": "Talento Geral",
  "repeatable": false,
  "prerequisite": "Nível 4 ou superior, Destreza 13 ou superior",
  "source": {
    "book": "Livro do Jogador 2024",
    "language": "pt-BR",
    "chapter": 5,
    "chapterTitle": "Talentos",
    "pdfPath": "doc/livro-jogador.pdf",
    "pdfPages": [
      205,
      217
    ],
    "extractedAt": "2026-06-25T01:46:09.812Z"
  },
  "benefits": [
    {
      "name": "Aumento no Valor de Atributo",
      "description": "Aumente seu valor de Destreza em 1, até no máximo 20."
    },
    {
      "name": "Visão às Cegas",
      "description": "Você tem Visão às Cegas com um alcance de 3 metros."
    },
    {
      "name": "Névoa de Guerra",
      "description": "Você explora as distrações da batalha e tem Vantagem em qualquer teste de Destreza (Furtividade) que realiza como parte da ação Esconder durante o combate."
    },
    {
      "name": "Atirador",
      "description": "Se você realizar uma jogada de ataque enquanto estiver escondido e errar a jogada, realizar a jogada de ataque não revela sua localização."
    }
  ]
}
